{
  "$schema": "https://json-schema.org/draft/2020-12/schema",
  "$id": "https://ui-chan-mcp.local/schema/cue.schema.json",
  "title": "Cue",
  "description": "1つの完成した見た目＋声を表す最小単位。1ファイル=1Cue、継承なし、完全に自己完結。視覚は生のPSDレイヤーパスのみ（名前付き抽象フィールドを作らない）。強さ違いは intensity ではなく別ファイルの別Cueとして表現する。say/set_expressionの分離に起因していたタイミング問題を避けるため、テキスト（セリフ）はこのファイルには含めない — テキストは set_cue 呼び出し時の引数（このスキーマの対象外）。任意の description フィールドのみ例外的にカタログ用メタデータとして許可する（AIエージェントがこのCueをいつ使うべきか把握するため。persona プロンプトが起動時に全Cueから動的に一覧を生成して渡す）。",
  "type": "object",
  "additionalProperties": false,
  "properties": {
    "label": {
      "type": "string",
      "description": "論理名。ファイル名（=cue名）は emo_anger_hi のように構造的・ソート可能にする一方、これは人間向けの読みやすくユニークな呼び名（例「激おこ」「侮蔑・塩対応」）。set_cueの実行には使われず、カタログ表示やエディタのグルーピング表示のための参照メタデータ。",
      "minLength": 1
    },
    "description": {
      "type": "string",
      "description": "このCueがどんな場面・気持ちを表すかの短い説明（人間・AI両方向けの参照情報）。set_cueの実行には一切使われず、MCPの persona プロンプトが起動時にcues/を読み込んでAIに一覧として渡す際にのみ使われる。カタログ用メタデータであり、見た目・声そのものには影響しない。",
      "minLength": 1
    },
    "internal": {
      "type": "boolean",
      "description": "trueなら、このCueはAI向けのCue一覧（persona プロンプトが生成するset_cue用カタログ）から除外される。set_cueで直接指定すれば動作はする（実行を禁止するフラグではない）。エージェントに直接選ばせたくないCueに付ける。固定セリフ（sequences/）の見た目はシーケンスのステップ側が自前で持つので、そのための部品Cueは作らない。ファイル名のprefix等の暗黙の命名規則ではなく、この明示的なフラグで判定する。省略時はfalse扱い。",
      "default": false
    },
    "select": {
      "type": "array",
      "description": "'*'ラジオレイヤーを選択するパスの配列。同じ階層(親フォルダ)のラジオを指定順に上書きできる。後に来る指定が勝つ。base（全Cue共通の初期状態、config側で定義）の後、このCueのselectが適用される。",
      "items": {
        "type": "string",
        "pattern": "^!",
        "description": "'/'区切りのPSDレイヤー名パス。ルートは常に必須フォルダ('!'始まり)。例: \"!目/*にっこり2\""
      },
      "default": []
    },
    "show": {
      "type": "array",
      "description": "ラジオではない通常レイヤー（汗・涙などの重ね着）を表示状態にするパスの配列。",
      "items": {
        "type": "string",
        "pattern": "^!"
      },
      "default": []
    },
    "hide": {
      "type": "array",
      "description": "通常レイヤーを非表示にするパスの配列。base側で既に非表示のものをこのCueで明示的に隠す必要は通常ない。",
      "items": {
        "type": "string",
        "pattern": "^!"
      },
      "default": []
    },
    "blink": {
      "type": "boolean",
      "description": "このCue表示中にまばたきアニメーションを有効にするか。目を大きく見開く／閉じているCue等ではfalseにして意図しないまばたきを防ぐ用途。省略時の扱いは実装依存（現行実装ではundefined=false扱い）。",
      "default": false
    },
    "voice": {
      "type": "object",
      "description": "このCue固有の声色。**感情スタイルの重みだけ**を持つ。声質を直に歪めるパラメータ（alp/huskiness）と、1行ごとの数値（pitch/speed/volume/intonation）は意図的に持たない——手で数値を書く設計をやめ、読み方はセリフの記法（**強調**・…・〜・？）とCueの delivery からアプリが導出する。→ src/app/prosody.ts",
      "additionalProperties": false,
      "properties": {
        "style_weights": {
          "type": "object",
          "description": "スタイル名 → 重み。例 {\"Happy\": 0.6, \"Bashful\": 0.4}。実行時にボイスの style_names 順の配列へ変換して送信する。**エンジンは重みを正規化するので、効くのは比率だけ。合計値には意味がない**（実測：{\"Sad\":0.3} と {\"Sad\":2.0} はバイト単位で同一の音声になる）。したがって {\"Sad\":0.3} は「控えめな悲しみ」ではなく {\"Sad\":1} と同じ。弱めたいときは他のスタイルとの比率で書く（例 {\"Sad\":0.3,\"Normal\":0.7}）。**合計は1に揃えて書くこと**——音は変わらないが、読む人の誤解を防ぐため。スタイル名は使用するVoiSonaボイスに依存するため、GET /api/talk/v1/voices/{voice_name}/{voice_version} の style_names で実在を確認すること。",
          "additionalProperties": {
            "type": "number",
            "minimum": 0,
            "description": "個々のスタイルの重み（比率）。合計1で書く。"
          },
          "propertyNames": {
            "minLength": 1
          }
        }
      }
    }
  },
  "examples": [
    {
      "select": [
        "!眉/*上がり",
        "!目/*にっこり2",
        "!口/*あは",
        "!頬・顔色/*頬2"
      ],
      "show": [],
      "hide": [],
      "blink": false,
      "voice": {
        "style_weights": {
          "Happy": 1.0
        },
        "alp": 0,
        "huskiness": 0
      }
    }
  ]
}
