{
  "label": "愛・ときめき",
  "description": "恋するときめき（deredere より手前の胸キュン）",
  "select": [
    "!奥の腕/*口元",
    "!手前の腕/*口元",
    "!頬・顔色/*頬赤め2",
    "!口/*ほわ",
    "!目/*細目ハート",
    "!目/*基本目セット/*ハート目",
    "!眉/*上がり"
  ],
  "voice": {
    "style_weights": {
      "Happy": 0.7,
      "Bashful": 0.3
    }
  }
}
