{
  "label": "罪悪感・申し訳",
  "description": "申し訳ない「すいませんねぇ」（謝る。気まずさ troubled と区別）",
  "select": [
    "!眉/*困り",
    "!目/*基本目セット/*目そらし1",
    "!奥の腕/*口元",
    "!手前の腕/*基本",
    "!口/*えへ"
  ],
  "show": [
    "!汗・涙/汗1"
  ],
  "blink": true,
  "voice": {
    "style_weights": {
      "Bashful": 1
    }
  }
}
