{
  "label": "ショック",
  "description": "ショック・悪い報せ「えっ!?」（負の驚き。純驚きの surprised_strong と区別）",
  "select": [
    "!眉/*上がり",
    "!目/*○○",
    "!奥の腕/*基本",
    "!手前の腕/*基本",
    "!口/*うわー"
  ],
  "show": [
    "!汗・涙/汗1"
  ],
  "voice": {
    "style_weights": {
      "Sad": 0.6,
      "Normal": 0.4
    }
  }
}
