{
  "label": "驚愕",
  "description": "大きな驚き（正の純粋な驚愕。負のショック shock と区別）",
  "select": [
    "!眉/*上がり",
    "!目/*基本目セット",
    "!目/*基本目セット/!白目/*白目見開き",
    "!目/*基本目セット/*縮小",
    "!口/*うわー"
  ],
  "show": [
    "!汗・涙/汗1"
  ],
  "voice": {
    "style_weights": {
      "Happy": 0.8,
      "Normal": 0.2
    }
  }
}
