{
  "label": "強い嫌悪・嫌悪感MAX",
  "description": "強い嫌悪・生理的な拒絶（顔をしかめ青ざめる。嫌悪 emo_disgust の強い版）",
  "select": [
    "!頬・顔色/*(非表示)",
    "!口/*えー",
    "!目/*基本目セット/*目そらし2",
    "!目/*基本目セット/!白目/*白目ジト",
    "!眉/*怒り1"
  ],
  "show": [
    "!頬・顔色/かげり"
  ],
  "voice": {
    "style_weights": {
      "Angry": 0.571,
      "Sad": 0.429
    }
  }
}
