{
  "label": "溺愛・愛でる",
  "description": "愛でる・「かわいいねぇ」（ういおじ化）",
  "select": [
    "!奥の腕/*指さし横",
    "!手前の腕/*腰",
    "!頬・顔色/*頬赤め1",
    "!口/*ほあー",
    "!目/*細目ハート",
    "!目/*基本目セット/*ハート目",
    "!目/*基本目セット/!白目/*白目ジト",
    "!眉/*上がり"
  ],
  "voice": {
    "style_weights": {
      "Happy": 0.7,
      "Bashful": 0.3
    }
  }
}
