{
  "label": "失望・げんなり",
  "description": "エラー・げんなり（取り乱さない）",
  "select": [
    "!口/*あ",
    "!目/*基本目セット/*縮小",
    "!目/*基本目セット/!白目/*白目見開き",
    "!眉/*困り"
  ],
  "show": [
    "!頬・顔色/かげり",
    "!汗・涙/汗1",
    "!汗・涙/汗2"
  ],
  "voice": {
    "style_weights": {
      "Angry": 0.5,
      "Sad": 0.5
    }
  }
}
